name,id,tier,rarity,tech/manufacturer,tags,uiTags,base value,unlocked,hidden,hiddenEverywhere,cost_frigate,cost_dest,cost_cruiser,cost_capital,script,desc,short,sprite
# MODULAR,,,,,,,,,,,,,,,,,,
Collapsed Cargo Holds,vayra_collapsedcargo,0,,,"defensive, special, req_spaceport","Defenses, Logistics, Requires Dock",2000,,,,8,15,20,40,data.scripts.hullmods.vayra_collapsedcargo,"Collapses the ship's cargo holds and welds them together for additional protection. Increases the ship's armor by %s, with no loss of mobility. The amount of effective protection that can be gained in this manner limits bonus armor to %s at most.

Reduces available cargo space by %s percent, as some storage can still be crammed into the resulting internal cavities between jury-rigged structural reinforcement beams. Increased stresses of combat-speed acceleration on the new, denser hull plating reduces peak combat performance time by %s percent.

Costs %s OP when installed on a civilian-class vessel without any military-grade sensors, flux-management infrastructure, or targeting equipment to get in the way.",Collapses cargo holds for additional armor.,graphics/icons/markets/shipbreaking.png
Collapsed Cargo Holds,vayra_collapsedcargo_free,,,,"defensive, special, req_spaceport, civOnly","Defenses, Logistics, Requires Dock",,,TRUE,,0,0,0,0,data.scripts.hullmods.vayra_collapsedcargo,"Collapses the ship's cargo holds and welds them together for additional protection. Increases the ship's armor by %s, with no loss of mobility. The amount of effective protection that can be gained in this manner limits bonus armor to %s at most.

Reduces available cargo space by %s percent, as some storage can still be crammed into the resulting internal cavities between jury-rigged structural reinforcement beams. Increased stresses of combat-speed acceleration on the new, denser hull plating reduces peak combat performance time by %s percent.

Costs %s OP when installed on a civilian-class vessel without any military-grade sensors, flux-management infrastructure, or targeting equipment to get in the way.",,graphics/icons/markets/shipbreaking.png
,,,,,,,,,,,,,,,,,,
# FOURTENFH BATLTEGRUeP,,,,,,,,,,,,,,,,,,
FOURTENFH BATLTEGRUeP,vayra_pirate_xiv,,,,,,,,TRUE,,0,0,0,0,data.scripts.hullmods.vayra_pirate_xiv,"This ship is ALLEGEDLY a survivor of the original 14th Domain Battlegroup which founded the Hegemony. It has been up-armored to the net benefit of %s standard units, and a military-grade power plant has been installed increasing speed, maneuverability, and flux characteristics by %s percent. Despite these modifications (and the clumsily spraypainted 'PHOoeEYNUkS' on the hull plating), it is unlikely that the Hegemony - let alone the Domain of Man - would ever make use of such a vessel.",,graphics/hullmods/vayra_pirate_xiv.png
Very Converted Cargo Bays,vayra_extremely_converted_hangar,1,,,,,,,TRUE,,0,0,0,0,data.scripts.hullmods.vayra_extremely_converted_hangar,"This ship's cargo hold has been hollowed out and converted to hold a trio of makeshift fighter vats, reducing available cargo space by %s. The jury-rigged nanoforges that produce fighter chassis are unreliable, and all components have major defects. Fighter speed reduced by %s, and damage taken increased by %s. Increases the ordnance point cost of bombers by %s, and of all other fighters by %s.

The shuttle bay, notably, remains unmolested. 

For now.",,graphics/hullmods/converted_hangar.png
Looted Thermal Pulse Cannon,vayra_looted_tpc,,,,,,,,TRUE,,0,0,0,0,data.scripts.hullmods.VayraLootedTpc,"This hull is packaged with a jury-rigged %s - no doubt stolen from the wreck of a derelict Onslaught-class battleship - which will %s whenever a suitable weapon mount is left empty and %s are available to mount it. While the weapon can be removed and replaced with another as normal, its supporting flux infrastructure is permanently integrated into the hull and %s as well as %s.",,graphics/hullmods/ballistics_integration.png
,,,,,,,,,,,,,,,,,,
# GENERAL BUILTINS,,,,,,,,,,,,,,,,,,
XIV Targeting Core,vayra_xiv_core,,,,,,,,TRUE,,0,0,0,0,data.scripts.hullmods.VayraXIVCore,Extends the range of nonmissile weapons by %s. Precludes the installation of a Dedicated Targeting Core or an Integrated Targeting Unit.,,graphics/icons/abilities/transponder.png
Light Ballistics Integration,vayra_light_ballistics,,,,,,,,TRUE,,0,0,0,0,data.scripts.hullmods.VayraLightBallistics,Reduces the ordnance point cost of small ballistic weapons by %s.,,graphics/icons/skills/advanced_countermeasures.png
Overtaxed Targeting System,vayra_overtaxed_targeting,,,,,,,,TRUE,,0,0,0,0,data.scripts.hullmods.vayra_overtaxed_targeting,"This ship's targeting mainframe is somewhat below spec and suffers from an inability to properly account for projectile travel times and aether-ballistic coefficients, reducing the range of Ballistic and Energy weapons mounted on the hull by %s.",,graphics/icons/skills/target_analysis.png
Targeting Pods,vayra_targeting_pods,,,,,,,,TRUE,TRUE,0,0,0,0,data.scripts.hullmods.vayra_targeting_pods,YOU NEVER SHOULD HAVE COME HERE AND NOW YOU'RE GONNA PAY,,
Very Ill-Advised Modifications,vayra_very_ill_advised,,,,,,,,TRUE,,0,0,0,0,data.hullmods.IllAdvised,"This hull's systems have been drastically and irreparably modified from spec, without certified engineering oversight or possibly without any oversight at all. Its systems appear to work correctly under routine conditions, but have a significant chance of critical malfunction when stressed.",,graphics/hullmods/vayra_very_ill_advised.png
Hardwired Mining Lasers,vayra_mining_tools,,,,,,,,TRUE,,0,0,0,0,data.scripts.hullmods.VayraMiningTools,"This hull integrates %s which will %s whenever an appropriate weapon slot is left empty and %s are available to equip them. A laser can be switched between configurations by removing it from the hull, but %s.",,graphics/hullmods/ballistics_integration.png
Internal Weapon Mounts,vayra_groundhog_sponsons,,,,,,,,TRUE,,0,0,0,0,data.scripts.hullmods.VayraGroundhogSponsons,"Originally designed for high-risk mining operations in dense asteroid cover or planetary debris, the Groundhog's main weapons emplacements are buried deep within armored sponsons which render them all but %s to disable through damage, short of destroying the ship.",,graphics/hullmods/vayra_groundhog_sponsons.png
Blasting Forge,vayra_bear_autoforge,,,,,,,,TRUE,,0,0,0,0,data.scripts.hullmods.VayraBearAutoforge,"The Bear contains a full-scale missile autoforge, originally dedicated to the production of Hammer-class mining charges but easily recoded for military-grade munitions. The autoforge slowly %s of all missile weapons at a rate of %s of each weapon's magazine every %s seconds.",,graphics/hullmods/missile_autofactory.png
Terminator Core,vayra_fake_terminator_core,,,,,,,,TRUE,,0,0,0,0,data.scripts.hullmods.VayraTerminatorCore,"Advanced - and very likely illegal - AI-controlled subroutines have fully optimized many aspects of this craft's performance. 

Autofire accuracy, damage to missiles and fighters, and beam weapon turn speed are all increased by %s. Dynamic stabilization algorithms extend beam range by %s and prevent the engines from flaming out when damaged or struck by EMP, and target identification networks allow point defense weapons to reliably distinguish flares from legitimate missile threats.",,graphics/hullmods/terminator_core.png
,,,,,,,,,,,,,,,,,,
# ANTEDILUVIAN,,,,,,,,,,,,,,,,,,
Atlantean Relic,antediluvian,,,,,,,,TRUE,,0,0,0,0,data.scripts.hullmods.Antediluvian,"The experimental p-space submersion systems of the Antediluvian Armada %s their sensor signature, enabling them to launch devastating hit-and-fade attacks against shipping in the Persean Sector. Originally designed for submarine warfare, their vessels hold up poorly in prolonged extraatmospheric engagements and suffer a %s increased rate of CR decay once their peak performance time has run out.",,graphics/hullmods/antediluvian.png
