name,id,tier,rarity,tech/manufacturer,tags,uiTags,base value,unlocked,hidden,hiddenEverywhere,cost_frigate,cost_dest,cost_cruiser,cost_capital,script,desc,short,sprite
Advanced Optics,advancedoptics,2,,,"offensive, merc",Weapons,1000,,,,5,10,15,25,data.hullmods.AdvancedOptics,Reduces the flux cost of beam weapons by %s with lenses that absorb less energy from the beams they focus.,Increases beam weapon range.,graphics/hullmods/advanced_optics.png
Advanced Targeting Core,advancedcore,,,,,,,,TRUE,,0,0,0,0,data.hullmods.AdvancedTargetingCore,"Eliminates the %s leading error margin, increasing the effective range of non-missile projectile weapons.",Greatly extends non-missile weapon range.,graphics/hullmods/advanced_targeting_core.png
Ballistic Rangefinder,ballistic_rangefinder,2,,,"offensive, merc",Weapons,8000,,,,5,10,15,25,RealisticCombat.com.fs.starfarer.api.impl.hullmods.BallisticRangefinder,"Eliminates the %s ranging error margin, increasing the effective range of non-missile projectile weapons.",Increases base range of small and medium weapons in ballisic slots.,graphics/hullmods/ballistic_rangefinder.png
Dedicated Targeting Core,dedicated_targeting_core,0,,,"offensive, merc",Weapons,2500,TRUE,,,0,0,15,25,data.hullmods.DedicatedTargetingCore,"Eliminates the %s leading error margin, increasing the effective range of non-missile projectile weapons.

Can not be installed on a frigate or a destroyer, and can not work in conjunction with Integrated Targeting Unit.

Most combat ships install either an Integrated Targeting Unit or a Dedicated Targeting Core, with the exception of more specialized variants.","Increases weapon range, more so for larger ships.",graphics/hullmods/targeting_core.png
High Scatter Amplifier,high_scatter_amp,3,,,"offensive, merc",Weapons,5000,,,,4,8,12,20,RealisticCombat.com.fs.starfarer.api.impl.hullmods.HighScatterAmp,Beam weapons deal hard flux damage to shields.,Reduces beam range; beams deal more damage and apply hard flux to shields.,graphics/hullmods/high_scatter_amp.png
Integrated Targeting Unit,targetingunit,3,,,"offensive, merc",Weapons,10000,,,,4,8,15,25,data.hullmods.IntegratedTargetingUnit,"Eliminates the %s leading error margin, increasing the effective range of non-missile projectile weapons.","Increases weapon range, more so for larger ships.",graphics/hullmods/integrated_targeting_unit.png
Targeting Supercomputer,supercomputer,,,,,,,,TRUE,,0,0,0,0,data.hullmods.TargetingSupercomputer,"Eliminates the %s leading error margin, increasing the effective range of non-missile projectile weapons.",Greatly extends non-missile weapon range.,graphics/hullmods/targeting_supercomputer.png